Good news for recycling Oak Ridgers: most of your recyclables are used for new products,"Only about 10-14% of what Oak Ridge and Knoxville city residents attempt to recycle is sent to a landfill, according to Tyler Adams, general manager, and Derek Senter, senior specialist for procurement,",The Oak Ridger,2025-05-05T18:21:54+00:00
"China's dying EV batteries, solar cells are powering a circular economy in new-energy era","One man's waste is Ma Long's treasure. And in the new-energy era, his map leads to exhausted lithium-ion batteries - veritable troves of reusable resources that are supercharging profits at Ma's company,",South China Morning Post,2025-05-05T05:32:56+00:00
"Recycle, don't ban plastics, manufacturers urge govt","The Pan-African Manufacturers Association has called on African governments to prioritise recycling and circular economy strategies over sweeping bans on single-use plastics, warning that the growing trend of outright prohibitions poses a major threat to the continent's fragile manufacturing base.",The Punch,2025-05-10T01:01:14+00:00
Coca-Cola partners with pro sports teams for innovative new project — here's what's happening,"Washington, D.C., was the latest area to participate in Coca-Cola Consolidated's latest eco-friendly initiatives focused on more recycling options in the country. The brand has forged partnerships with local sports teams and created better packaging,",The Cool Down,2025-05-04T11:15:22+00:00
UK landfill tax reforms set to affect packaging sector,Packaging firms across the UK are urged to consider how proposed Landfill Tax reforms may affect disposal costs and compliance.,Packaging Gateway,2025-05-06T09:21:56+00:00
"Hospitality sector has multiplier effect on economy, key to India's 2047 target: Amruda Nair of Araiya Hotels | INTERVIEW","The growth in hospitality sector is led by the willingness to spend on leisure more frequently and in higher proportions than before. According to Amruda Nair of Araiya Hotels & Resorts, supported by continued demand and infra developments making travel affordable and accessible,",ET Now,2025-05-09T06:21:24+00:00
New Grand Rapids facility transforms wood waste into clean power using AI,"Woodchuck's new biomass facility in Grand Rapids uses AI to turn wood waste into clean energy. GRAND RAPIDS, Mich. — A clean energy breakthrough could be coming to Grand Rapids, where a $2 million facility is transforming how Michigan handles wood waste.",WZZM13,2025-05-08T21:37:00+00:00
Niger: the weather resistant garden,Floods and drought have not stopped one Niger woman from producing delicious sustainable produce in her market garden. The circular economy approach that she uses is still unusual. But she's making it work against the odds.,DW,2025-05-05T14:59:21+00:00
Four companies ink deal to help realise Ipoh's circular economy plan,IPOH City Council (MBI) signed a memorandum of understanding with four companies to make its vision of establishing a viable circular economy in the city possible. Mayor Datuk Rumaizi Baharin said ...,The Star,2025-05-09T00:00:00+00:00
EXCLUSIVE: Aduro's Deal With Cleanfarms Targets Farm Plastic Recycling Revolution And Scalable Sustainability,Aduro Clean Technologies Inc. (Nasdaq: ADUR) signed an MOU with Cleanfarms to explore using Aduro's HCT for chemically recycling difficult-to-process plastic waste in agriculture.,Benzinga,2025-05-08T10:30:00+00:00
Oman's circular economy: Wealth from waste,"As the global community grapples with intricate sustainability challenges, the Sultanate of Oman is charting a distinctive course rooted in",Oman Observer,2025-05-12T17:39:00+00:00
LG Electronics aims to collect 8 mln tons of old appliances for recycling by 2030,"South Korea's home appliances giant LG Electronics Inc. aims to collect 8 million tons of old appliances for recycling by 2030 as part of efforts to promote the circular economy, company officials said Tuesday.",Yonhap News Agency,2025-05-06T01:37:05+00:00
Finding the next growth engine: How to make the startup-corporation collaboration work,"In a mutually beneficial relationship, startups today benefit from larger companies' resources, market reach, and more.",Fast Company,2025-05-12T12:00:00+00:00
Zach Bryan Removes Collaboration With John Moreland From Streaming Services Amid Feud,"Bryan said he'd rerelease the song ""Memphis; The Blues"" without Moreland after the singer questioned Bryan's $350 million payday for selling his publishing catalog and signing a new record deal.",Yahoo,2025-05-13T00:42:00+00:00
Beyond VR: How Spatial Computing Can Transform Workplace Collaboration,Spatial computing is a powerful technology that fundamentally changes how we interact with digital environments and objects.,Forbes,2025-05-06T12:00:00+00:00
Decades-Old Tampa Cold Case Solved Through DNA Technology and International Collaboration,"DNA technology has helped the Hillsborough County MEO solve a 28-year-old case by identifying Rodolfo Barcenas Guerrero's remains, in collaboration with the Mexican Consulate and U.S. Customs.",Hoodline,2025-05-12T13:23:00+00:00
Lilly plans to expand Purdue University collaboration with up to a $250 million investment to accelerate pharmaceutical innovation,Eli Lilly and Company (NYSE: LLY) and Purdue University announced Friday (May 9) a significant expansion of their long-standing,Purdue University,2025-05-10T12:19:00+00:00
Inside Cleveland's innovative new MidTown Collaboration Center,"CLEVELAND, Ohio - Step into the latest, brightest new space in Cleveland's MidTown neighborhood, and you might find someone from Hyland Software trading ideas with a professor from Case Western Reserve University,",cleveland.com,2025-05-12T13:35:00+00:00
Why Willy Chavarria Remixed an Unsung '70s Hoops Shoe for His Latest Adidas Collaboration,"Just a couple days after the Met Gala, the celebrated designer threw a serious bash in LA to launch his major new Three Stripes collection.",GQ,2025-05-12T13:00:00+00:00
"MidTown Collaboration Center welcomes new eatery, brewery, music venture (photos)","CLEVELAND, Ohio - The latest ventures within the MidTown Collaboration Center on the East Side encompass good food, craft beer and live music, but all three share one driving force: Community.",cleveland.com,2025-05-10T12:10:00+00:00
Lauren Bush Lauren Celebrates the New FEED x Minnow Collaboration!,"Lauren Bush Lauren of FEED and Morgan Smith, founder of Minnow, welcomed a glamorous group of women—including Daphne Oz, Lydia Fenet, Dr. Amanda Kahn, Morgan Hutchinson, Jessie Randall, Dee Poku, Rachelle Hruska,",Daily Front Row,2025-05-12T19:56:00+00:00
Why we want collaboration with our governments — ITUC-Africa GS on union-government engagement,"In this exclusive interview with CHRISTIAN APPOLOS, the General Secretary of the African Regional Organisation of the International Trade Union Confederation (ITUC-Africa), Comrade Akhator Joel Odigie,",Tribune Online,2025-05-13T00:41:45+00:00
"Gavin Kaysen's Bellecour ending Cooks collaboration, moving to 2 standalone locations","The five-year collaboration between Gavin Kaysen's Bellecour and longtime St. Paul cookware retailer and culinary school Cooks of Crocus Hill is coming to an end, with Bellecour ""evolving"" into two standalone bakeries opening later this year.",Bring Me The News,2025-05-12T13:10:19+00:00
BIZNOTE: West Seattle collaboration creates OutletGuard - a big idea to protect little people,By Anne Higuera Reporting for West Seattle Blog There's nothing like a bonk on a toddler's head to get a parent's attention. So how do you turn that bonk into a preventive product you can market nationally or internationally?,West Seattle Blog,2025-05-06T04:04:00+00:00
Rockford Summit on Racism fights bigotry with community collaboration,"On Thursday, the Rockford Summit on Racism returns with community members and leaders assembling for diversity. Eliminate Racism 815 hosts the event alongside the Rockford Park District, YWCA Northwestern Illinois, NAACP Rockford and the Rockford Regional Health Council.",WIFR,2025-05-09T04:42:00+00:00
"Norte, Life Skills Center, Carter's Composting team up for biking collaboration","TRAVERSE CITY— Norte and the Life Skills Center have been working together since the fall to help teach students about safety while biking, but recently Carter's Compost became involved.",9&10 News,2025-05-12T23:23:00+00:00
Emory expands primary care access with new collaboration,"Atlanta-based Emory Healthcare is expanding primary care access in Georgia through a new collaboration with the digital medical practice Galileo. The effort will allow Emory patients to access on-demand virtual primary care,",Becker's Hospital Review,2025-05-09T14:15:00+00:00
"Novation's Bass Station II has officially entered its Swifty era, thanks to a new collaboration","The Bass Station II was originally launched in 2013, itself a successor to the original Bass Station from 1993. This isn't its first artist collaboration, either - there was also an Aphex Twin-themed firmware update in 2019. Find out more on the Novation website. The Bass Station II Swifty Edition costs $580/£450.",MusicRadar,2025-05-08T16:16:48+00:00
The First Descendant Season 3 update and NieR: Automata collaboration announced,"Publisher Nexon and developer Nexon Games announced have announced the Season 3 update for free-to-play cooperative looter shooter The First Descendant, which includes a new battlefield, Hover",Gematsu,2025-05-11T17:24:00+00:00
AS Monaco and Zumub continue their collaboration,"AS Monaco and Zumub are pleased to announce the extension of their partnership until 2026.Official sports nutrition supplier to the Rouge & Blanc since 2021, Zumub will continue to support the club",Yahoo Sports,2025-05-07T15:00:00+00:00
Business Buzz: Starion Bank earns national recognition for collaboration with DoorDash,"Bismarck-based Starion Bank offers delivery drivers, known as ""Dashers,"" access to deposit accounts and debit cards.",InForum,2025-05-10T12:15:00+00:00
"Amid Widespread Poverty, Argentine School Wins Global Prize for Community Collaboration","Colegio María de Guadalupe, located outside Buenos Aires, is recognized for its efforts to uplift students through family involvement, job training and values-based education.",WTTW News,2025-05-09T18:28:00+00:00
Sri Lankan union leaders respond to US trade war with class collaboration,"The May Day rally of the Joint Trade Union Alliance made crystal clear that its concern is not the jobs and conditions of workers, but to shore up Sri Lankan industries which rely heavily on US markets.",World Socialist Web Site,2025-05-13T04:12:00+00:00
'DWTS' Pro Derek Hough Reveals Major New Collaboration,"Derek Hough launched an exciting new collaboration on Thursday, May 8. The DWTS pro brought his dance expertise to footwear, working closely with Fuego, a dance and lifestyle footwear company based in Miami, to create shoes ""that meet the needs of both dancers and everyday movers.""",AOL,2025-05-09T07:07:00+00:00
"Collaboration Advances Lymphoma Care: Andrew Evens, DO","Multidisciplinary efforts help promote the success of clinical trials and innovation for patients with various forms of lymphoma, explained Andrew Evens, DO.",The American Journal of Managed Care,2025-05-12T15:01:00+00:00
Make science more collegial: why the time for 'adversarial collaboration' has come,Bringing together proponents of rival theories to test their ideas against each other can advance science — but only if all sides can accept that they might be wrong.,Nature,2025-05-06T00:00:00+00:00
Rio Tinto extracts first gallium under collaboration with Indium,"Mining major Rio Tinto , said on Wednesday it had extracted its first primary gallium as part of a collaboration with U.S.-based Indium Corp that aims to eventually produce commercial quantities of the critical,",Reuters,2025-05-07T15:11:23+00:00
Healthcare Project Team Integration And Collaboration: What's Changed In The Last 25 Years?,Vance Consulting's Gary Vance discusses how project team integration and collaboration in healthcare design has evolved in the last 25 years.,Healthcare Design Magazine,2025-05-09T14:36:00+00:00
Philadelphia Union announce Year of the Snake capsule in collaboration with P's and Q's,"Nestled on the always-bustling South Street between 8th and 9th is P's & Q's, a streetwear store built and operated by Chinese American brothers and Union fans Rick and Ky Cao. The pair spent their childhood nearby in the neighborhood,",Philadelphia Union,2025-05-12T15:14:00+00:00
Smarter Together: Making The Case For AI-Human Collaboration,"The narrative surrounding artificial intelligence (AI) is clear and forever gaining momentum: AI is the future. It will revolutionize business, make companies faster, smarter, and more efficient. Get on board,",UAE Moments,2025-05-08T12:00:00+00:00
'DWTS' Pro Derek Hough Reveals Major New Collaboration,"Derek Hough launched an exciting new collaboration on Thursday, May 8. The DWTS pro brought his dance expertise to footwear, working closely with Fuego, a dance and lifestyle footwear company based in Miami,",Parade,2025-05-08T22:07:25+00:00
Milken Institute Global Conference 2025 Concludes With Visionary Dialogue and Bold Global Collaboration,"Milken Institute Global Conference brought together 4,500+ global leaders across business, policy, philanthropy, and science to explore solutions to the world's greatest challenges. Now concluded, all sessions are available to watch on demand,",Amazon S3,2025-05-10T04:51:28+00:00
Optimum expands collaboration with Google Cloud,"Optimum has expanded its collaboration with Google Cloud to introduce intelligent, AI-driven customer service using generative AI technology. The partnership aims to create an intelligent and personalised customer experience across web interactions,",Verdict,2025-05-07T15:49:26+00:00
Botswana Keen to Further Heighten Collaboration with Ethiopia: Deputy Ambassador,"Botswana is eager to strengthen its cordial bilateral relations with Ethiopia in various spheres, Botswana's Deputy Ambassador to Ethiopia told ENA. Deputy Ambassador Poppy Mhambi said that Botswana and Ethiopia collaborate in different elements,",Ethiopian News Agency,2025-05-11T00:03:29+00:00
JJJJound's Next Asics Collaboration Features a Brand New Sneaker Design,JJJJound previewed Monday an Asics Gel-Kayano 14 collaboration which appears to use the model's popular synthetic silver and white mesh build. The key addition to the JJJJound ite,Footwear News,2025-05-06T19:25:35+00:00
Olivier Rousteing Discusses His Cultural Collaboration With Johnnie Walker,"Whisky meets haute couture in ""Couture Expression,"" a debut collaboration from Olivier Rousteing for Johnnie Walker's new Vault platform.",Forbes,2025-05-05T19:33:00+00:00
Fair Harbor Enters Footwear With Rothy's Collaboration,The Fair Harbor x Rothy's capsule will include two shoes and one piece of swimwear. The shoe styles include the Ravello Boat Shoe that is being created using Rothy's proprietary k,Women's Wear Daily,2025-05-08T04:02:00+00:00
New collaboration of crime fighters working with new law to put smackdown on shoplifters,"Organized theft rings targeting businesses across Memphis then re-selling their loot online.Now, a new collaboration of crime fighters is working with a new law to put the smackdown on shoplifters. So many smash-and-grab scenes have Memphis store owners seeing red.",Action News 5,2025-05-05T23:22:50+00:00
MoonPay enters strategic collaboration with TRON,"TRON and MoonPay collaboration enables US users to buy TRX, enhancing access to TRON's DeFi ecosystem with MoonPay's platform.",Crypto Briefing,2025-05-07T17:40:00+00:00
Crocs new End. x And Wander hiking shoe collaboration looks built for coastal adventures,Crocs has teamed up with fashion brands And Wander and End. to create a springy shoe for exploring land and water this summer,Advnture,2025-05-07T15:00:00+00:00
"Cayuga legislature committees advance economic development collaboration, IT services agreement","Last week the Cayuga County Planning and Government Operations committees reviewed an extensive list of development initiatives, program updates, and key resolutions, including a proposal to fund a centralized office for economic development partners and a new IT services agreement with the City of Auburn.",FingerLakes1.com,2025-05-12T06:25:00+00:00
Dr Pepper's 'Cool' New Collaboration Draws Mixed Reactions Among Fans,"Dr Pepper's ""cool"" new collaboration is rolling out to store shelves, but not everyone is on the same page about the '90s kids' dreams. In advance of Jurassic World Rebirth's release this summer, the beloved soda brand has jumped aboard the press train,",Parade,2025-05-04T04:58:29+00:00
SportsEngine Play Extends Collaboration With Pixellot To Offer Free Streaming To Youth Sports Facilities Nationwide,"SportsEngine Play, a streaming service for youth sports, has agreed to a multi-year extension with AI-automated sports content provider Pixellot, accelerating the NBC streamer's efforts to activate game streaming from youth",TV News Check,2025-05-07T17:40:32+00:00
"Dangote, NNPC pledge collaboration for national growth","The President/Chief Executive Officer of the Dangote Group, Aliko Dangote, on Thursday paid a courtesy visit to the Group Chief Executive Officer of the Nigerian National Petroleum Company Limited, Mr Bayo Ojulari,",The Punch,2025-05-09T02:01:10+00:00
Jordan Brand's Awake NY x Air Jordan 5 Collaboration Was Revealed in a New Color,"After Awake NY revealed in February its upcoming Air Jordan 5 collaboration in ""Arctic Pink,"" a look at the second colorway in the two-sneaker collection has now surfaced. The second sneaker to join the collaboration is a ""Black/Racer Blue"" Air Jordan 5.",Footwear News,2025-05-06T18:10:20+00:00
"Jin Jiang Hotels China Region and RIYAZ International Sdn. Bhd, form RJJ Hotels Sdn Bhd to drive Cross-Border Hospitality Collaboration",New Hotel Management Agreement signed with Sanher Investment & Development Co. Ltd. to build the first Metropolo Hotel in Southeast Asia,The Manila Times,2025-05-13T05:25:00+00:00
MCE pledges collaboration with health professionals to tackle health delivery issues,"Mr Joseph Kwame Antwi Awal, the Municipal Chief Executive of Nkwanta South, has called for effective collaboration with the health directorate to tackle health delivery issues.The MCE emphasised the crucial role of health services in enhancing the overall well-being of people during a courtesy call from the health directorate.",Ghana News Agency,2025-05-09T13:22:24+00:00
Atif Aslam and Nusrat Fateh Ali Khan's collaboration shakes the Internet,"Two legends, one timeless track and a virtual collaboration that has left the internet speechless. Atif Aslam, the modern-day voice of Pakistan, has paid tribute to the legendary Nusrat Fateh Ali Khan (NFAK) with a stunning rendition of ""Sanu Ek Pal Chain Na Awaey"" on the latest season of Velo Sound Station.",Daily Times,2025-05-04T03:28:00+00:00
Is Halsey Releasing a Collaboration With Evanescence's Amy Lee?,"Are pop star Halsey and Evanescence singer Amy Lee about to drop a new song together? Fans sure seem to think so, and they're hella excited about the possibility. Halsey sparked speculation of an upcoming collaboration Monday night (May 5) when she texted fans a mysterious snippet of an unreleased song.",Loudwire,2025-05-06T12:25:53+00:00
Scientists discover fungus-based silver nanoparticles that could fight COVID-19,Researchers from the University of São Paulo in Brazil have discovered that silver nanoparticles produced by a fungus called Trichoderma reesei might be an effective way to prevent and treat COVID-19.,Knowridge Science Report,2025-05-07T14:12:00+00:00
This living fungus-based building material can repair itself over a month,"Researchers in a laboratory in Montana have been growing a new kind of building material. It's not forged in a furnace or cast in molds, but carefully cultivated like a living organism.",MSN,2025-04-16T20:32:00+00:00
Fungus-based material could offer a sustainable concrete alternative,Fungus-based material could offer a sustainable concrete alternative SEM and confocal microscopy images of S. pasteurii grown in liquid cultures with non-viable mycelium scaffolds with the red ...,New Atlas,2025-04-21T00:00:00+00:00
Scientist's research on fungus-based fat replacer rolls out for low-fat dessert production at hotel,"The Research Institute for Future Food (RiFood) at the Hong Kong Polytechnic University (PolyU) has developed a fat replacer called AkkMore. This formula has been used in the production of low-fat food products, including low-fat ice cream with a fat ...",sciencex,2024-04-18T09:16:00+00:00
Living fungus-based building material repairs itself for over a month,"Cell Press. (2025, April 16). Living fungus-based building material repairs itself for over a month. ScienceDaily. Retrieved May 4, 2025 from www.sciencedaily.com / releases / 2025 / 04 ...",Science Daily,2025-04-16T00:00:00+00:00
"Q. Which is the greener building material, fungus or concrete?","And one promising candidate is construction materials made from fungi. Recent studies have shown that fungus-based materials are safer, more sustainable alternatives to construction materials made ...",MSN,2025-03-05T20:30:00+00:00
"""Nothing to sustain that"": Biden denies reports of cognitive decline, trashes Trump on ""The View""","Biden said reports of his slipping faculties were ""wrong"" and criticized Trump's first 100 days on the talk show",Salon.com,2025-05-08T19:23:00+00:00
The Observer: Experience alone isn't enough to sustain you,"Books take you beyond your own life experience. Unfortunately, it seems that reading is falling out of fashion.",Yahoo,2025-04-30T09:03:00+00:00
'We were not able to sustain the level of the first half performance',"Spurs condense the pitch when you have the ball so not easy to sustain possession and have good attacks. ""Niclas played his part in a decent performance, certainly first half and gives us a longer option as well.",BBC,2025-05-04T16:14:00+00:00
After the apocalypse: Urban and near-urban farming may be enough to sustain mid-size cities,"Urban agriculture alone could sustain about 20% of a temperate, mid-sized city's population after a global catastrophe, but combining it with near-urban farming could feed the entire city.",Phys.org,2025-05-07T00:00:00+00:00
"Maruti, Mahindra sustain sales in April","Amid challenging market environment, Maruti Suzuki India and Mahindra & Mahindra reported an increase in vehicle dispatches to dealers last month while Tata Motors and Hyundai saw a year-on-year drop in sales.",Free Press Journal,2025-05-02T11:06:00+00:00
SEC to sustain reforms with eye on FATF review,THE Securities and Exchange Commission (SEC) will sustain and expand its reform measures ahead of the next scheduled evaluation of global money laundering and terrorist financing watchdog Financial Action Task Force (FATF) in 2027.,The Manila Times,2025-05-11T16:17:00+00:00
"IAG Orders 71 Large Jets from Boeing, Airbus to Grow Network","IAG SA announced a major aircraft order for widebody jets, doubling down on a long-haul business that's powered its earnings and helps the airline group upgrade from older models.",Bloomberg,2025-05-09T06:09:00+00:00
Panthers fail to sustain momentum and fall to 0-2 in second-round series against Toronto,"Marchand scored 15 seconds into the second period by beating Toronto goaltender Joseph Woll, who started in place of the injured Anthony Stolarz, top shelf to cap a sequence that started with Eetu Luostarinen forcing a turnover on the boards.",Miami Herald,2025-05-08T06:10:00+00:00
"Pakistan's Military Facing Critical Artillery Shortage, Can Sustain War For Only Four Days: Report","Pakistan's military can sustain war for only 4 days due to severe ammo shortage after Ukraine arms deals, reports ANI.",NewsX,2025-05-03T20:56:00+00:00
Four people sustain burn injuries in Narayanganj gas line explosion,"A gas line explosion has left at least four people injured, three of them with severe burns, in Narayanganj. The incident occurred at Kazipara Manju Textile in Rupganj Upazila on Thursday morning. The victims were identified as Md Kabir, 45, Saiful Islam, 32, Md Hannan, 52 and Saiful, 28.",bdnews24.com,2025-05-01T09:02:00+00:00
Talks with Bangladesh aim to sustain reform momentum: IMF,"An IMF staff team, led by Chris Papageorgiou, visited Dhaka from April 6 to 17 to conduct a combined third and fourth review of Bangladesh's reform efforts under the Extended Fund Facility, Extended Credit Facility, and the Resilience and Sustainability Facility.",The Daily Star,2025-05-06T06:31:00+00:00
"UK Welcomes India-Pakistan Ceasefire, Urges Sustained De-escalation","The UK on Saturday welcomed the ceasefire agreed between India and Pakistan, calling on both nations to sustain their steps towards de-escalation. ""Today's ceasefire between India and Pakistan is hugely welcome.",ABP News,2025-05-10T17:05:27+00:00
How To Build A Stackable Retaining Wall For Your Garden,"From there, you'll dig a trench and prepare your wall's base. After, you'll lay out the paver blocks in courses. It's also recommended to install drain pipes every 25 to 50 feet to ensure your ...",House Digest,2025-02-11T12:17:00+00:00
Surge in prices of buliding materials hits construction industry in Coimbatore,"Coimbatore: The construction industry in Coimbatore is reeling under the impact of soaring prices of essential building materials such as blue metal, .",The Times of India,2025-05-11T19:16:00+00:00
