"Focus on research: 3D printing will help space pioneers make homes, tools and more","On Earth, 3D printing can fabricate, layer by layer, thousands of things, from replacement hips to hammers to homes. These devices take raw materials, such as plastic, concrete or metal ...",Centre Daily Times,2025-04-12T06:10:00+00:00
Starbucks opens its first 3D-printed store. Is it cheaper than the real thing?,"In Georgetown, Texas, an entire community of 100 homes was recently built using 3D-printing. The company who built the community, Lennar, says they're seeing costs drop with each build.",Fast Company,2025-04-23T00:00:00+00:00
Colorado company building 3D printed homes to help tackle housing crisis,"On Monday, Governor Jared Polis signed the state's latest budget, which includes funding to continue the wolf reintroduction program — but also adds new guidelines aimed at better protecting ...",FOX31 Denver,2025-03-26T23:48:00+00:00
Four wacky Mars home designs Nasa is eyeing for Red Planet colony - from 3D-printed 'hives' to cosy mushroom houses,"NASA considering a number of designs for its future Mars colonists, from 3D-printed habitats to structures grown from mushrooms. To combat dangerous surface-level radiation on the Red Planet, Nasa ...",The Sun,2025-04-13T08:24:00+00:00
Japan Deploys Entire 3D-Printed Train Station,"To do it, JR West contracted Serendix, which specializes in 3D printed homes. Serendix delivered the station in four parts by rail, which were then pieced together during a break in the train ...",Futurism,2025-04-03T13:07:00+00:00
"WOL3D sees surge in B2C 3D printing adoption, eyes expansion into homes with affordable product line","""Our mission is to make this tech mainstream - what computers were to homes in the 2000s, 3D printers are today."" The Indian 3D printing landscape, once confined to niche industrial ...",retail.economictimes.indiatimes,2025-04-21T19:23:00+00:00
"Anker's eufyMake UV Printer E1 brings 3D-texture printing to homes for $1,699 on Kickstarter","Anker Innovations' new creative tool brand, eufyMake has announced a new device aimed at hobbyists, artists, and small businesses. The newly unveiled UV Printer E1 is being positioned as a ...",Gizmochina,2025-04-17T00:00:00+00:00
Wilmington-Cape Fear Parade of Homes: Here's what to know about the homes and admission,"Those types of home are more will soon be on display thanks to the Wilmington-Cape Fear Home Builders Association. The group will hold its 39th annual Parade of Homes, which showcases the craftsmanship,",Wilmington Star-News,2025-04-13T09:00:56+00:00
Tech CEO reveals revolutionary 3D-printed homes built in 24 hours: 'The house will crumble before this one does',Azure Printed Homes' 3D printing technology is ready for the challenges of a warming planet. CBS News reported on the California-based startup's goal to speed up recovery after extreme weather events.,MSN,2025-04-06T06:33:00+00:00
3D printed and factory-built homes could help tackle housing crisis,"Grant Hamel, CEO and co-founder of VeroTouch, stood inside one of the homes his company built, the wall behind him made out of rolling layers of concrete, distinct to a 3D printer. The technology ...",MSN,2025-03-26T10:31:00+00:00
Step Inside The 3D-Printed Homes Revolutionizing Housing,"A potential solution to the housing crisis, 3D-printed homes are an innovative alternative to traditional homebuilding. From Texas to Mexico, here are some of the world's best 3D-printed",lovemoney.com,2025-03-29T17:15:00+00:00
Austin 3D printing company Icon to build homes in Mueller,"Austin 3D printing construction company Icon will break ground this summer on a dozen homes in the Mueller development. Why it matters: The project in the mixed-income, mixed-use community at the ...",Axios,2025-03-04T12:37:00+00:00
Colorado company receives state grant to expand 3D printed homes efforts,"Colorado's Innovative Housing Incentive Program (IHIP) was awarded to VeroTouch after the completion of their first 3D printed homes. But unlike standard 3D printers, VeroTouch printers use concrete.",MSN,2025-03-03T14:37:00+00:00
Are 3D-printed homes the future for Shawnee County?,"But what if there was a way that could be exponentially shorter? The answer to that could be 3D-printed homes. ""Whether you're printing a piece for a stove or a toy, the general concept is the ...",MSN,2025-03-31T03:58:00+00:00
"3D printing will help space pioneers make homes, tools and other stuff they need to colonize the moon and Mars","On Earth, 3D printing can fabricate, layer by layer, thousands of things, from replacement hips to hammers to homes. These devices take raw materials, such as plastic, concrete or metal ...",Phys.org,2025-03-13T17:51:00+00:00
Starbucks Is Opening a New Location Next Week — And It Was Constructed with a 3D Printer,"Starbucks' first 3D-printed coffee shop is opening in Brownsville, Texas, next week. The 1,400-square-foot building shell has been 3D-printed, meaning that a massive 3D printer mechanically piped layer after layer of a concrete mixture to build the complete exterior structure.",Entrepreneur,2025-04-22T21:20:14+00:00
"Anker's eufyMake UV Printer E1 brings 3D-texture printing to homes for $1,699 on Kickstarter","The post Anker's eufyMake UV Printer E1 brings 3D-texture printing to homes for $1,699 on Kickstarter appeared first on Gizmochina. This article may contain affiliate links that Microsoft and/or ...",MSN,2025-04-17T06:54:00+00:00
"Focus on research: 3D printing will help space pioneers make homes, tools and more","Space pioneers will bring 3D printers with them to make the tools, structures and habitats space pioneers need to survive in a hostile alien environment.",Yahoo,2025-04-12T10:11:00+00:00
Physicists create ultra-stretchable graphene via an accordion-like rippling effect,"Graphene is a ""miracle material"": mechanically extremely strong and electrically highly conductive, ideal for related applications. Using a unique method, physicists at the University of Vienna led by Jani Kotakoski have for the first time made graphene drastically more stretchable by rippling it like an accordion.",Phys.org,2025-05-06T15:21:24+00:00
Groundbreaking accordion effect makes graphene more stretchable by removing atoms,Austrian researchers have uncovered a new property of graphene as removing atoms creates waves that make it more stretchable than ever,Interesting Engineering,2025-05-07T13:42:00+00:00
Argo Expands Strategy with Graphene Leaders Canada to Explore Graphene-Infused Asphalt Innovations,"Argo Living Soils Corp. (CSE: ARGO) (OTCQB: ARLSF) (FRANKFURT: 94Y0) (""Argo"" or the ""Company"") is pleased to announce that, following our May 5, 2025, news release regarding the research and development (R&D) agreement with Graphene Leaders Canada Inc.",Yahoo Finance,2025-05-12T13:00:00+00:00
Quantum twisting microscope measures phasons in cryogenic graphene,"By adapting their quantum twisting microscope to operate at cryogenic temperatures, researchers have made the first observations of a type of phonon that occurs in twisted bilayer graphene. These ""phasons"" could have implications for the electron dynamics in these materials.",Physics World,2025-05-06T07:20:00+00:00
Nonequilibrium Effects in Graphene Revealed by Nano-Infrared Imaging,"In a recent Nature Communications article, researchers explored how strong electric fields influence electron behavior in graphene, uncovering nonequilibrium effects typically associated with high-energy physics.",AZoNano,2025-05-06T15:29:00+00:00
"First graphene, now AI: has overhyped given way to oversold?","The axiom that 'history doesn't repeat itself, but it often rhymes' is usually attributed to Mark Twain, a renowned storyteller who made a fortune from his literary output, only to be pushed into bankruptcy through highly speculative and failed investment ventures.",Investors Chronicle,2025-05-09T15:24:00+00:00
Marker ink transforms into graphene-based electric circuit for low-cost sensors,"The first case of an electric circuit created using a simple marker and a laser beam shows that simple and sustainable materials can generate innovative applications on any surface, such as a coffee cup.",Phys.org,2025-04-30T07:30:02+00:00
Physicists use machine learning to find out how layered gases and metals melt,"In physics, a phase transition is a transformation of a substance from one form to another. They happen everywhere, from beneath the Earth's crust to the cores of distant stars, but the classic example is water transitioning from liquid to gas by boiling.",Phys.org,2025-05-06T17:12:03+00:00
"Breakthrough extends fuel cell lifespan beyond 200,000 hours, paving the way for clean long-haul trucking","Researchers have developed a new catalyst design capable of pushing the projected fuel cell catalyst lifespans to 200,000 hours. The research marks a significant step toward the widespread adoption of fuel cell technology in heavy-duty vehicles,",Science Daily,2025-04-25T00:00:00+00:00
Exotic Matter Found in Graphene: Quantum Computing Leap,"Another key factor in these discoveries is the moiré pattern, a pattern that forms when the five-layer graphene interacts with nearby boron nitride. Moiré refers to the repeating spatial pattern created when overlaying sheets of atoms are slightly offset at a particular angle or are different sizes.",Mirage News,2025-05-01T11:30:00+00:00
Realme GT 7 Series' Global Debut Set; Brings Graphene to Phones,"The Realme GT 7 is its current smartphone of the moment. The phone has launched in China, packed to the brim with flagship features (at a more sensible price than most flagships). Now, we have the date that the device is going to find its way to the global stage, and it isn't that far off.",TalkAndroid,2025-05-09T20:00:00+00:00
Graphene Layers and Lasers Create Unusual Terahertz Source,The need for improvements in terahertz-spectrum sources. How lasers and graphene layers are being used to create harmonics into the THz band. The multiple experiments that were run and the ...,Electronic Design,2025-04-16T00:00:00+00:00
Partnership set to produce graphene-based polymers for the hydrogen sector,Graphmatech and Levidian are to co-develop new graphene-based polymer solutions for the hydrogen sector and others.,The Engineer,2025-05-01T11:00:00+00:00
INBRAIN Neuroelectronics Awarded €4 Million Grant from Spain's PERTE Chip Program to Advance Graphene-Based Brain-Computer Interfaces,"INBRAIN Neuroelectronics graphene-based brain-computer interface semiconductor technology (Photo credit: INBRAIN Neuroelectronics). The PERTE Chip initiative - ""Strategic Project for Economic Recovery and Transformation of Microelectronics and Semiconductors"" - aims to strengthen the design and production capabilities of the microelectronics and semiconductor industry in Spain from a comprehensive perspective,",The Bakersfield Californian,2025-05-06T05:58:00+00:00
OTC Markets Group Welcomes Black Swan Graphene Inc. to OTCQX,"OTC Markets Group Inc. (OTCQX: OTCM), operator of regulated markets for trading 12,000 U.S. and international securities, today announced Black Swan Graphene Inc. (""Black Swan"") (TSX-V: SWAN; OTCQX: BSWGF),",Yahoo Finance,2025-05-08T11:00:00+00:00
Nagaland varsity team develops aminated graphene technique,Guwahati: A research team led by Nagaland University developed an innovative and economical technique for creating an advanced material used in 'super.,The Times of India,2025-05-05T17:59:00+00:00
Graphene Star selects Gehring-Montgomery as North American distributor,"Warminster, PA - Graphene Star Ltd, a UK-based leader in eco-innovative graphene materials, announced a strategic partnership with Gehring-Montgomery, Inc. (GMI), appointing the Pennsylvania-based specialty chemical distributor as its official distributor for the North American market.",Rubber World,2025-05-07T06:33:00+00:00
Realme GT 7 To Launch With Groundbreaking IceSense Graphene Cooling Tech,"On May 7, 2025, Realme gave tech enthusiasts something to talk about by announcing a bold leap in smartphone technology. The company's upcoming flagship, the Realme GT 7, will be the first phone in the world to feature a graphene-based IceSense cooling design, aimed at tackling one of the biggest annoyances for smartphone users, overheating.",Mashable India,2025-05-07T17:11:00+00:00
Graphene-enhanced supramolecular gels direct how drug molecules crystallise,"Chemists and chemical engineers have created a graphene-based supramolecular gel matrix that can control how pharmaceutical compounds crystallise. The system unlocks a set of strategies to selectively prepare materials that can exist in more than one crystalline form, known as polymorphs.",Chemistry World,2025-04-28T11:08:00+00:00
New production facility for high-purity graphene announced in Texas,"A new facility in Texas to manufacture high-purity graphene powder from acetylene has been announced by HydroGraph Clean Power Inc. At capacity, the facility will generate thousands of metric tons per year.",Chemical Engineering,2025-05-01T04:00:00+00:00
Carbon Credit: Graphene May Be the New 'Super' Concrete,"The patented Pulsed Capacitive Discharge (PCD) instrument they built generates graphene from waste in milliseconds, offering a way to tackle plastic pollution and carbon emissions from cement. Researchers say the PCD technique uses high-powered electric pulses to heat carbon-rich waste to over 3000 Kelvin,",The Times of India,2025-04-29T18:55:00+00:00
Graphene-based biosensor breaks detection records for non-invasive monitoring of diabetes,"A breakthrough biosensor detects glucose in human tears at ultra-low concentrations, opening new avenues for wearable health monitoring technologies.",Nanowerk,2025-05-08T16:00:00+00:00
Accordion effect makes graphene stretchable,Using a worldwide unique method physicists have for the first time made graphene drastically more stretchable by rippling it like an accordion.,Nanowerk,2025-05-06T10:36:00+00:00
How to transform the ink of a marker into a graphene-based electric circuit. The latest frontier of innovation has been published in Advanced Science,"The study, the result of a collaboration between the Sant'Anna School of Advanced Studies in Pisa, Graz University of Technology, CSGI and the University of Florence, opens up new scenarios in the field of electronics.",EurekAlert!,2025-04-29T00:00:00+00:00
Graphene: Breakthrough Industrial Applications,"As research continues and production scales up, graphene is enabling a new generation of breakthrough industrial applications",Chemical Engineering,2025-05-01T04:00:00+00:00
First Graphene Enters South-East Asian Market,"According to First Graphene CEO Michael Bell, the deal underscores the growing industry recognition of PureGRAPH's ability to improve the durability of safety boots and other apparel, enabling them to withstand harsh workplace and environmental conditions.",Finance News Network,2025-05-07T15:08:00+00:00
"Graphene electroluminescence, an unexpected discovery! 💡","For the first time, electroluminescence has been observed in a metal-like material thanks to the use of high-quality graphene. Semiconductor-based light-emitting diodes (LEDs) have",Techno-Science.net,2025-04-28T04:00:05+00:00
"Faster than SRAM! New flash memory tech from China is millions of times faster than NAND rivals from US, Japan or Korea - but please change its name","Chinese researchers claim to have developed the fastest non volatile flash memory to date, but it needs a better name than PoX.",TechRadar,2025-04-26T17:37:10+00:00
"Graphene Market worth $2.94 billion by 2029, at a CAGR of 24.0%, says MarketsandMarkets™","Delray Beach, FL, April 22, 2025 (GLOBE NEWSWIRE) -- The Graphene Market is projected to grow from USD 1.00 billion in 2024 to USD 2.94 billion by 2029, at a CAGR of 24.0% during the forecast ...",Yahoo Finance,2025-04-22T04:00:00+00:00
InBrain Neuroelectronics picks up $4.5M grant to support BCI development,InBrain Neuroelectronics announced today that it received a $4.5 million (€4 million) grant from Spain's PERTE Chip Program.,MassDevice,2025-05-06T06:01:00+00:00
"Breakthrough US hydrogen fuel cell promises 200,000-hour life with minimal power loss","Scientists in the US have designed a new fuel catalyst that has the potential to significantly extend the lifespan of hydrogen fuel batteries to over 200,000 hours, in a bid to develop a clean energy solutions in long-haul transportation.",Interesting Engineering,2025-04-29T13:14:10+00:00
Novel Technique Dramatically Increases Graphene's Elasticity,"The University of Vienna's study on graphene's stretchability offers groundbreaking insights, crucial for developing advanced materials in electronics.",AZoNano,2025-05-07T14:54:00+00:00
InBrain awarded €4m to accelerate BCI development,InBrain Neuroelectronics has won a €4m ($4.5m) grant from the Spanish Ministry of Industry and Tourism to develop its brain-computer interface (BCI) platform technology. InBrain's BCI is made of graphene arranged in a hexagonal lattice.,Medical Device Network,2025-05-06T15:13:27+00:00
Graphene-based electronic nose uses AI for analysis,"This technology converts scent molecules into electrical signals and trains AI models on their unique patterns. It holds great promise for applications in personalized healthcare, the cosmetics industry,",Nanowerk,2025-05-02T16:00:00+00:00
INBRAIN Neuroelectronics Awarded €4 Million Grant from Spain's PERTE Chip Program to Advance Graphene-Based Brain-Computer Interfaces,"INBRAIN Neuroelectronics, a clinical-stage neurotechnology company developing precision brain-computer interfaces (BCIs) powered by graphene, announced today it has been awarded a €4 million grant by the Spanish Ministry of Industry and Tourism through the PERTE Chip initiative.",The Eagle-Tribune,2025-05-06T05:58:00+00:00
Alice & Bob to Build $50M Quantum Lab in Paris,"Alice & Bob, a fault-tolerant quantum computing (FTQC) company, today announced the construction of a $50 million quantum computing laboratory in Paris to support the development of its products. The company has selected Quantum Machines,",insideHPC,2025-05-09T18:06:00+00:00
Argo Living Soils Corp. Announces Research and Development Agreement with Graphene Leaders Canada Inc. to Advance Graphene Concrete Solutions,"Argo Living Soils Corp. (CSE: ARGO) (OTCQB: ARLSF) (FSE: 94Y0) (""Argo"" or the ""Company"") is pleased to announce it has entered into a research and development (R&D) agreement with Graphene Leaders Canada (GLC) Inc.",Yahoo Finance,2025-05-05T13:00:00+00:00
Black Swan Graphene Announces the Appointment of Jobin George as Technical Sales Manager (EMEA) to Accelerate Market Expansion,"Black Swan Graphene Inc. (TSXV: SWAN) (OTCQB: BSWGF) (FSE: R960) (""Black Swan"" or the ""Company"") is pleased to announce the appointment of Jobin George as Technical Sales Manager for the Europe, Middle East,",Yahoo Finance,2025-04-30T11:30:00+00:00
Haydale Graphene Industries plc (HDGHF),"As US officials are set to enter trade negotiations with China this weekend, Wall Street speculates where US tariffs against China could fall to from the current 145% levy. Regan Capital chief ...",Yahoo Finance,2025-05-09T00:00:00+00:00
First Graphene Limited (FGPHF),First Graphene ( ASX:FGR ) Full Year 2024 Results Key Financial Results Net loss: AU$6.33m (loss widened by 17% from FY... First Graphene ( ASX:FGR ) Full Year 2024 Results Key Financial Results ...,Yahoo Finance,2025-05-06T00:00:00+00:00
Can Nano-Engineered Anodes Boost Li-ion Battery Capacity and Longevity?,Researchers at Dongguk University unveiled a nanoscale-engineered hybrid anode material that enhances Li-ion battery energy storage and cycling stability.,Electronic Design,2025-04-29T13:42:00+00:00
Alice & Bob to build Paris lab for quantum computing,"JERUSALEM (Reuters) -Israeli startup Quantum Machines said on Thursday it would partner with French tech startup Alice & Bob in an advanced quantum computing laboratory in Paris. Alice & Bob is building the $50 million lab and Quantum Machines,",AOL,2025-05-08T12:01:00+00:00
"FSU scientists discover exotic states of matter in graphene, offering new possibilities for quantum computing",Florida State University Assistant Professor of Physics Zhengguang Lu and fellow researchers have discovered new states of matter in graphene — a form of carbon made from a single layer of atoms — with unusual electrical properties that could make them a valuable tool for building more powerful electronics and quantum computers.,EurekAlert!,2025-05-01T00:00:00+00:00
"As renewable diesel surges, sustainability claims are deeply questioned","Renewable diesel is a biofuel made from vegetable oils and animal fats touted by proponents as an almost miraculous ""drop-in"" transition fuel able to drastically cut greenhouse gas emissions while easily replacing fossil diesel in all manner of engines.",Mongabay News,2025-05-12T14:02:05+00:00
Top Renewable Energy Sources Shaping the Future Globally,"Discover the top renewable energy sources like solar, wind, hydro, and biomass, driving a sustainable future and global change. The post Top Renewable Energy Sources Shaping the Future Globally appeared first on weather-fox.",Weather-Fox,2025-05-10T09:15:00+00:00
How Spain's Success in Renewable Energy May Have Left It Vulnerable,"The Iberian Peninsula's widespread blackout raises questions about the resilience of the electric power infrastructure in the two countries — and to an extent, the rest of Europe.",The New York Times,2025-04-29T17:14:00+00:00
Flexibility options are a central concept for highly renewable energy systems research,"To address the variability of renewable energy for a stable supply, 22 distinct types of flexibility options are found in 100% renewable energy systems research articles, categorized into power-to-X,",pv magazine International,2025-05-13T05:43:00+00:00
Effort to bring renewable energy to the state could hit a roadblock under proposed legislation,"Effort to bring renewable energy to the state could hit a roadblock under proposed legislation It's one of two new holidays he announced. The vice president has a terrible track record with popes! Defense Secretary Pete Hegseth, in a scathing X post Thursday, said a West Point professor who resigned from the academy will not be missed.",Yahoo,2025-05-09T21:46:00+00:00
Trump budget seeks to slash $21 billion from renewable energy programs,"The proposal calls for deep cuts to electric vehicle infrastructure, climate research and National Park Service operations while promoting fossil fuel development.",PhillyVoice,2025-05-02T23:07:00+00:00
"More than 100 National Renewable Energy Lab employees laid off in Colorado, elsewhere","The federal government has laid off more than 100 employees at the National Renewable Energy Laboratory's Colorado lab, an agency spokesperson confirmed on Tuesday.",CBS News,2025-05-07T04:00:00+00:00
"After Spain's blackout, questions about renewable energy are back",The massive power outage that hit the Iberian peninsula last month has reignited a debate in Spain over the country's plan to phase out its nuclear reactors and generate more power with renewable energy.,Associated Press News,2025-05-09T06:01:00+00:00
Mass. Appeals Court says 'Frankenpermit' for disputed Palmer Renewable Energy biomass plant still valid,"Opponents, including the Conservation Law Foundation and City Councilor Michael A. Fenton, say they'll keep fighting.",MassLive,2025-05-08T22:24:00+00:00
More than 100 fired from National Renewable Energy Lab,"More than 100 staff members have been fired from the National Renewable Energy Laboratory, spokespeople for the lab confirmed Tuesday. A National Renewable Energy Lab spokesperson cited ""stop work",The Hill,2025-05-06T21:34:43+00:00
Texas Lawmakers Want To Use 'Police Power' of the State To Halt Renewable Energy Projects,"Texas generates the most renewable energy in the nation. Three Republican bills being advanced by the state legislature could halt Texas' green energy progress and give fossil fuels a leg up in the state's energy market. Senate Bill 388, which has passed ...",Reason,2025-05-02T15:20:14+00:00
PBK Miner Highlights the Role of Renewable Energy in Making Cloud Mining More Accessible and Sustainable,"Reuters, the news and media division of Thomson Reuters, is the world's largest multimedia news provider, reaching billions of people worldwide every day. Reuters provides business, financial, national and international news to professionals via desktop terminals, the world's media organizations, industry events and directly to consumers.",Reuters,2025-05-07T10:48:00+00:00
Longyuan SA Renewable supports local graduates in becoming wind turbine technicians,"An intimate graduation ceremony was held at the SARETEC auditorium in Bellville on Thursday, during which several hard-working individuals received their certificates to qualify as wind turbine technicians.",IOL,2025-05-12T12:04:23+00:00
Former Energy Ministers from Saint Lucia and Uruguay Named REN21 Renewable Energy Champions,The REN21 has named James Fletcher of Saint Lucia and Dr Ramón Méndez Galain of Uruguay as its first Renewable Energy Champions.,Inter Press Service,2025-05-12T13:28:00+00:00
Breakthrough in fuel cell recycling turns 'forever chemicals' into renewable resources,A new technique that uses soundwaves to separate materials for recycling could help prevent potentially harmful chemicals leaching into the environment.,Science Daily,2025-05-06T19:02:00+00:00
