Academic standards set to pass after lack of vote from Legislature,Oklahoma lawmakers let Ryan Walters' controversial social studies standards take effect by declining to vote before the legislative deadline.,The Journal Record,2025-04-30T21:03:00+00:00
'Very concerned': Oklahoma lawmakers allow new social studies standards to take effect,"Oklahoma lawmakers will not vote on the State Board of Education's (SBE) new social studies standards. This means the controversial guidelines will go into effect next school year. Even though three lawmakers,",KOKH Fox 25,2025-04-30T01:21:50+00:00
Fate of California's auto standards will come down to Senate battle,"The House took a trio of votes this week targeting California's decades-old authority to enforce its own environmental standards, setting the stage for a significant standoff in the U.S. Senate.",Los Angeles Times,2025-05-01T17:09:45+00:00
Lawsuit filed against controversial social studies standards,"Former Oklahoma Attorney Mike Hunter is representing a group of parents, grandparents and educators out of Oklahoma County that have filed a lawsuit against the State Board of Education on the new social studies standards.",102.3 KRMG,2025-05-07T21:25:17+00:00
"Senate approves resolution to repeal Biden-era rule on refrigeration, freezer energy standards",The Senate on Thursday passed a resolution sponsored by Sen. Ashley Moody (R-Fla.) disapproving of the Biden administration's rule related to energy conservation standards for commercial,The Hill,2025-05-01T17:15:40+00:00
Defense secretary orders review of medical standards for military enlistment,"Defense Secretary Pete Hegseth signed a memorandum, April 24, 2025, directing a comprehensive review of medical conditions that",United States Army,2025-04-29T11:32:00+00:00
Lawmakers will not consider resolution to stop proposed controversial social studies standards,Oklahoma Senate Pro Tem Lonnie Paxton (R-Tuttle) said the Senate would not consider a joint resolution against the new social studies guidelines by the May 1st deadline.,KFOR,2025-04-29T22:21:17+00:00
"Fort Belvoir taps new command sergeant major, responsible for soldier welfare and standards","Fort Belvoir's Command Sgt. Maj. Daniel Hopkins passed the torch Friday to Atlanta native Brandon Creel during a change of responsibility ceremony at the garrison. The occasion was marked by the passing of the garrison colors,",InsideNoVa,2025-05-10T17:30:00+00:00
The Body Project program challenges beauty standards,"BYU Women's Services hosts The Body Project, a program that focuses on challenging beauty standards. BYU Women's Services has been running The Body Project since 2021. The program is designed to empower women to combat society's beauty standards.",The Daily Universe,2025-05-09T19:00:00+00:00
GAEC and GSA host regional training to increase Africa's food safety standards,"By Stanley Senya Accra, May 12, GNA-The Ghana Atomic Energy Commission (GAEC) and the Ghana Standards Authority (GSA) has launched a regional training programme in Accra to enhance food safety standards across Africa.",Ghana News Agency,2025-05-12T12:21:16+00:00
Better English standards and decade in UK to be demanded before citizenship,Better English standards and decade in UK to be demanded before citizenship - Sir Keir Starmer will promise to 'tighten up' all elements of the system.,The Independent,2025-05-12T06:35:40+00:00
Effects of practice standards on opioid prescribing and chronic pain management,"In an effort to curb misuse of opioids and prevent overdose deaths, the College of Physicians and Surgeons of British Columbia released a legally enforceable practice standard, Safe Prescribing of Drugs with Potential for Misuse/Diversion ,",News-Medical.Net,2025-05-12T12:00:24+00:00
'America Has To Beat China In The AI Race': Ted Cruz Warns Against 'Heavy-Hander Regulations' For AI,"At a Senate Commerce Committee hearing last week, Sen. Ted Cruz (R-TX) spoke about AI regulations.",Dailymotion,2025-05-12T18:28:10+00:00
New 'junk fees' regulations have gone into effect,"New rules on ""junk fees"" from the Federal Trade Commission won't save you money, but they should save you from being unhappily surprised. Lina Khan, who was chair of the FTC when the upcoming change was announced last year,",KOAT Channel 7,2025-05-13T01:30:00+00:00
Tech Executives Urge Senators to Rethink Regulations for AI,"The leaders of some of the biggest technology and artificial intelligence companies will go to Congress on Thursday with a wish list of sorts that at its top has doing away with regulation they say inhibits their firms' growth and by default,",Bloomberg,2025-05-08T09:00:00+00:00
"Colorado House attempts late-night move to delay AI regulations, but effort fails",House Democrats' 11th hour move Tuesday night tried to resurrect a dead-and-buried plan to delay Colorado's artificial intelligence regulations. But a filibuster by a fellow Democrat,The Denver Post,2025-05-07T16:09:00+00:00
Governor Ivey signs bills to strengthen voter ID regulations and improve data collection for immigrants,"MONTGOMERY, Ala. ( WSFA) - Governor Ivey signed two bills aimed at strengthening immigration regulations into law Monday. Senate bill 63, which requires law enforcement to collect DNA form immigrants in custody, and Senate bill 158, a measure to strengthen restrictions around noncitizen voting, passed the state legislature with bipartisan support.",WSFA 12 News,2025-05-13T00:47:00+00:00
The Role Of Data Governance In Meeting Evolving Privacy Regulations,"By establishing clear policies for data ownership, access and quality, you can reduce regulatory risk, improve operational efficiency and build customer trust.",Forbes,2025-05-05T13:00:00+00:00
Trump signs orders ending Biden-era environmental regulations,President Trump joined lawmakers in the Oval Office late Friday afternoon to sign a few orders targeting Biden-era actions.,KFOX-TV,2025-05-09T15:27:00+00:00
Bipartisan pair of Ohio lawmakers proposes regulations on reselling utility service to residents,Submetering is when third party middlemen purchase electric or another utility at wholesale prices and then resell it.,WOSU Public Media,2025-05-09T14:29:00+00:00
Florida hemp industry wins another reprieve from regulations this year,"A year ago, members of Florida's hemp industry were lobbying Gov. Ron DeSantis to veto a bill regulating hemp-derived THC products that many claimed if signed into law would be",chronicleonline.com,2025-05-11T13:18:00+00:00
New federal regulations to require upfront pricing for vacation rentals and event tickets,The Federal Trade Commission expects its new regulations will help consumers avoid wasted hours searching for total costs by ensuring transparent pricing for services.,FOX 13 Utah,2025-05-06T18:11:00+00:00
Waterloo pharmacy charged with violating controlled-substance regulations,Two Iowa-licensed pharmacies affiliated with the Walgreens and CVS chains are charged with violating state regulations.,KCRG,2025-05-09T02:51:00+00:00
'Take away this pain': Families speak on proposed Nebraska medical cannabis regulations,"At just 7 years old, Teddy Bronson of Omaha has faced six brain surgeries, been prescribed 14 different drugs and used about half a million dollars in medical hardware to fight his drug-resistant epilepsy that at one time had him enduring an average of 3,",KNOP,2025-05-10T23:49:00+00:00
"Colleyville officials lay out regulations for e-bikes, e-scooters",Prohibiting e-bikes and scooters after dusk unless equipped with proper lighting and reflectors Requiring riders under 16 to wear helmets on public property Holding parents and guardians responsible for knowingly allowing their child or ward to violate restrictions $100 fine and a required safety class for the first offense,Community Impact,2025-05-07T05:00:00+00:00
Henderson Rolls Out New E-Bike Regulations to Enhance Safety and Preserve Public Spaces,"Henderson implements e-bike regulations for public spaces, allowing pedal-assist bikes on trails, but restricting throttle bikes to areas for motorized vehicles.",Hoodline,2025-05-07T21:50:00+00:00
Missouri Department of Transportation Eases Regulations to Accelerate Flood Relief Efforts,"MoDOT issues a waiver allowing carriers to exceed vehicle weights by 10% for flood relief until May 14, 2025, with conditions for safety.",Hoodline,2025-05-06T18:30:00+00:00
Denver considers new regulations for e-bikes and scooters,"A newly proposed ordinance introduced by councilmembers Chris Hinds, Sarah Parady and Darrell Watson aims to regulate how and where scooters are ridden and parked, with a sharp focus on public safety, pedestrian access and accountability.",9news.com,2025-05-09T22:25:00+00:00
Proposed legislation would ease California environmental regulations,"LOCOMOTIVES Act aims to limit California's ability to place ""unsustainable"" regulations on trains crossing into the state",Trains,2025-05-07T15:28:00+00:00
Driveway Discussions; South Bethany Leaders Discuss Boat and RV Regulations,South Bethany's town council discussed creating an ordinance to regulate RVs and boats on neighbors' properties at Friday's council meeting.,WBOC TV,2025-05-09T22:20:00+00:00
"Child Advocate recommends state regulations for homeschoolers, others withdrawn from school following Waterbury captivity case","The Office of the Child Advocate is recommending the state change its laws, to give the state some oversight over children that are withdrawn from school for homeschooling, or other equivalent instruction.",WFSB,2025-05-05T21:36:02+00:00
Mine near Wrangell prompts tribal concerns about Canadian mining regulations,"The new owners of the Red Chris Mine in British Columbia hope to expand the copper and gold project, which is already bigger than Wrangell Island.",Alaska Public Media,2025-05-06T02:48:00+00:00
House GOP proposes 10-year ban on state AI regulations,A Republican tax bill released late Sunday seeks to block states from regulating artificial intelligence (AI) models for the next 10 years. The bill text from the House Energy and Commerce,The Hill,2025-05-12T16:37:46+00:00
PFAS pollution is hurting some small NC businesses. They say a lack of regulations makes it worse,"PFAS, also known as ""forever chemicals,"" are found in several North Carolina waterways, including the Cape Fear River. Powerful lobbying groups like the NC Chamber have opposed legislative and regulatory efforts to stop PFAS at the source.",WUNC,2025-05-08T17:24:00+00:00
Trump Plans Trio of Executive Actions Targeting Regulations,"President Donald Trump is expected to sign a trio of new executive actions on Friday designed to reduce the impact of regulations, part of an effort the White House has said will inspire economic growth.",Bloomberg,2025-05-09T19:19:00+00:00
Republicans in Congress Use Obscure Law to Roll Back Biden-Era Regulations,"As G.O.P. lawmakers have largely ceded power to President Trump, they are also pushing the bounds of a little-known statute to undo federal rules — and potentially undermining the filibuster.",The New York Times,2025-05-03T09:01:00+00:00
Pollution Related To Space Is Getting Worse As Trump And Musk Target Research And Regulations,"Their pollution was something on the minds of many (with some strategies to mitigate it already in place, like for Ariane 6 ), but there was never such a constant stream of launches before. Just in the first four months of 2025,",IFLScience,2025-05-12T15:18:01+00:00
Court snubs bankers over forex regulations,"The High Court of Malawi in Lilongwe has thrown away, with costs, a judicial review application filed by the Bankers Association of Malawi (BAM) challenging the constitutionality of the recently introduced Exchange Control (Holding Foreign Currency Denominated Accounts and Mandatory Conversion of Foreign Currency Receipts) Regulations (ECR) 2024.",The Nation Online,2025-05-10T04:38:00+00:00
Video of Mark Carney announcing new auto regulations is AI-generated,"Canada's government plans to phase out the sale of new gas-powered vehicles by 2035, but a video supposedly showing Prime Minister Mark Carney announcing an imminent prohibition of older cars along with a slew of other transportation rules is not authentic.",Yahoo,2025-05-06T18:28:00+00:00
7 New Travel Regulations in 2025 That Could Ruin Your Vacation,"You might have your hotels locked in and your flights on time, but 2025 is shaping up to be the kind of year where one missed detail can mess up an entire trip. Countries are tightening entry rules, airlines are adding fees,",AOL,2025-05-12T18:00:00+00:00
5 trends in health plan regulations to watch in new Trump administration,Employment law experts explore five health plan regulation trends that may shift as the Trump administration brings new priorities.,HR Executive,2025-05-02T12:30:00+00:00
Trump administration seeks to ID anticompetitive regulations,"The U.S. Federal Trade Commission and the Department of Justice are seeking to identify anticompetitive government regulations, the administration said on Monday.",Reuters,2025-05-05T21:34:00+00:00
"Trump Signs Orders Scrapping Biden-Era Rules, Targets Appliance And Consumer Product Regulations","President Donald Trump has signed a series of executive orders repealing key Biden-era energy regulations. These include controversial standards imposed on gas water heaters, household appliances, commercial refrigerators,",Amazon S3,2025-05-10T08:16:59+00:00
Order seeksk to ease regulatory burden on Americans,"President Donald Trump signed an executive order Friday afternoon to deter criminalization of Americans who violate federal regulations as opposed to laws passed by Congress. Trump signed the order to ""ease the regulatory burden on everyday Americans and ensure no American is transformed into a criminal for violating a",The Center Square,2025-05-10T05:00:00+00:00
"Dunleavy orders freeze on state employee hiring, travel and new regulations due to fiscal crunch","A freeze on state employee hiring and travel, as well as development of new regulations, was ordered by Gov. Mike Dunleavy on Friday in what he called cost-control measures due to the state's increasingly perilous fiscal situation.",Juneau Empire,2025-05-09T05:30:00+00:00
Trump to sign order discouraging criminal enforcement of regulatory offenses,"President Donald Trump plans to sign an executive order discouraging criminal enforcement of regulatory offenses, in a bid to combat the overcriminalization of federal regulations, a White House official told Reuters on Friday.",Reuters,2025-05-09T19:59:31+00:00
DOGE Put a College Student in Charge of Using AI to Rewrite Regulations,A DOGE operative has been tasked with using AI to propose rewrites to the Department of Housing and Urban Development's regulations—an effort sources are told will roll out across government.,Wired,2025-04-30T19:34:00+00:00
"CA Gas Could Hit $8.44 per Gallon in 2026 Due to Refinery Closures, Regulations",A new analysis has found California gasoline prices could rise to $8.44 per gallon by the end of 2026 after the pending closure of two refineries — one-fifth of the state's refining capacity — and the onset of new state regulations.,storage.googleapis.com,2025-05-08T20:49:53+00:00
Horner sees 'unnatural' racing after competitors are forced to 'drive to regulations',"There has been much discussion about wheel-to-wheel racing in Formula 1 over the recent weeks. In Jeddah, Max Verstappen lost a place after the start in his battle against Oscar Piastri, but the Dutchman could keep the lead against Lando Norris in Miami.",GPblog,2025-05-06T09:43:00+00:00
New federal regulations to require upfront pricing for vacation rentals and event tickets,The Federal Trade Commission expects its new regulations will help consumers avoid wasted hours searching for total costs by ensuring transparent pricing for services. (Scripps News),Scripps News,2025-05-06T17:18:25+00:00
Florida's evolving condo regulations: A balance of safety and affordability,Surfside safety measure indirectly helped catch a structural issue at a 12-story Clearwater condo. But the new laws have also caused a financial strain.,WTSP,2025-05-08T20:51:54+00:00
M-Sport fears one-marque WRC in 2027 as technical regulations debate intensifies,"The FIA remains confident that 20 cars could line up in the World Rally Championship in 2027, but how many manufacturers will be involved is unclear with time ticking for teams to be ready",Autosport,2025-04-29T15:52:03+00:00
Trump's executive order tightens CDL regulations to enhance road safety,"In a bold move, President Donald Trump has signed an executive order to tighten regulations on commercial driver's licenses, focusing on language proficiency and legal residency. This initiative aims to improve road safety and protect American jobs.",Soy Aire,2025-05-07T17:11:00+00:00
White House Council on Environmental Quality Releases Draft NEPA Template Following CEQ's Rescission of Longstanding Regulations,"Nonetheless, the draft template includes notable potential departures from NEPA practice under CEQ's previous regulations — originally adopted in 1978 — and appears to prioritize shorter environmental review periods and greater adherence to statutory time limits,",National Law Review,2025-05-09T23:58:00+00:00
"Trump ENDS Biden-era Regulations, Says 'No to High Energy…' | Signs Executive Orders | WATCH","President Donald Trump has signed a series of executive orders repealing key Biden-era energy regulations. These include controversial standards imposed on gas water heaters, household appliances, commercial refrigerators,",Amazon S3,2025-05-10T06:02:58+00:00
Education commissioner says NY may trade away private school regulations,"The Board of Regents issued a defiant defense Monday of its regulations for private schools, saying that some state legislators are trying to get the rules watered down in exchange for budget votes. In March,",Times Union,2025-05-05T21:28:14+00:00
DOJ Offers Narrow Window to Comply With New Data Security Rules,Morrison Foerster attorneys explain how companies should navigate the new security requirements under DOJ's bulk data regulations and NIST compliance.,Bloomberg Law News,2025-05-09T08:30:00+00:00
Buttigieg Says Black Babies Come At 'Discount' — Gets Smacked Down By Adoption Expert,"A leading adoption advocate rebuked former Transportation Secretary Pete Buttigieg for suggesting racial disparities in adoption fees, calling the claim",Independent Journal Review,2025-05-06T20:02:00+00:00
'Rent' Producer Jeffery Seller Reveals How Adoption & Sexuality Influenced Broadway Work in New Memoir 'Theater Kid',"Acclaimed producer Jeffrey Seller has just released his memoir titled Theater Kid: A Broadway Memoir, sharing a look into his life pre and post Broadway fame. The novel is currently number one on Amazon's Broadway Biographies list and on sale for $22.",Billboard,2025-05-12T19:05:15+00:00
Local clinic's adoption program faces uncertain future amid financial struggles,"Woodstock Spay Neuter Clinic has offered low-cost veterinary care in Lexington for nearly 23 years. But now, it's confronted with an uncertain future for its adoption program.",LEX 18,2025-05-13T02:00:00+00:00
"Expert says Pete Buttigieg's ""culture-war shorthand"" on the adoption process is false & ""damaging""",Buttigieg claimed it is more expensive to adopt white children than Black children and that there is a separate list of parents who only want white kids.,LGBTQ Nation,2025-05-06T17:13:00+00:00
"Judge denies adoption for unmarried Fargo couple, citing North Dakota law",A Fargo couple who have lived together for 10 years were denied the ability to adopt three children they had fostered. Their attorney says it was a misinterpretation of the law.,InForum,2025-05-10T11:55:00+00:00
Pete Buttigieg got real about transracial adoption. It's making waves - with good reason.,"Some now-adult transracial adoptees are determined to share their stories too, to combat what they say is an overly rosy narrative about adoption.",USA TODAY,2025-05-08T18:46:59+00:00
SQSPCA to host free adoption event and wellness clinic,"ONEONTA, N.Y. (WBNG) -- The Susquehanna Society for the Prevention of Cruelty to Animals hosts a free adoption event and wellness clinic at Neahwa Park. According to the SQSPCA, the event aims to provide services for pet owners who may have difficulty affording basic food and medical care for their cats and dogs.",WBNG,2025-05-12T21:41:00+00:00
Over 30 huskies involved in an alleged animal cruelty case are ready for adoption,"The 32 dogs seized in the alleged animal cruelty case are now the property of the Lewis and Clark Humane Society (LCHS) after being relinquished from their owner, Heather Dawn Prody.",KTVH,2025-05-08T19:34:00+00:00
Super Dog Adoption Day in Providence,"PROVIDENCE, R.I. (WJAR) — Hundreds of dogs were available at the Super Adoption Day event held Saturday at the WaterFire Arts Center in Providence. The dogs came from 13 shelters, on hand for potential adopters to meet and connect with.",WJAR,2025-05-11T02:45:21+00:00
Most common dog breeds available for adoption in Massachusetts,"Collecting data from 13,527 animal shelters and rescues in the U.S., Canada, and U.S. territories, the SAC report also found that the overall dog adoption rate has dipped by about 1% from 2023. However,",WWLP,2025-05-10T09:59:00+00:00
Adoption Options: Finding your new 'furry friend',"Bring your furry friends and celebrate with us in support of animal welfare. The fun is taking place Saturday, June 21 from 12 p.m. - 7 p.m. Location: 45 North Vineyard & Winery, 8580 E Horn Rd, Lake Leelanau.",WPBN,2025-05-09T11:28:00+00:00
KHS waiving all adoption fees on adult dogs for 'Empty the Shelters' event,"The Kentucky Humane Society is waiving adoption fees for adult dogs in its ""Empty the Shelters"" event. All adoption fees are being waived on KHS dogs one year and older from now until May 15. Adopters are still responsible for the licensing fee of $10.50 and leash/collar fees of $10.",WLKY,2025-05-06T15:32:00+00:00
"Cher, Chrissy make treks from Puerto Rico, Georgia for adoption","On this Saturday's Wake Up Wags, we met Cher and Chrissy, two pups who made long journeys from Puerto Rico and Georgia to be adopted. Cher was rescued alongside",WIVB News 4,2025-05-10T12:30:00+00:00
Twenty dogs seized from Coram property now up for adoption,Twenty dogs that were found living in unsanitary conditions and seized from a property in Coram back in March are now available for adoption.,KPAX News,2025-05-06T17:45:00+00:00
Caddo Parish Animal Services host pet adoption event,The event held Saturday (May 10) aimed to find loving homes for pets by offering reduced adoption fees and promoting pet adoptions.,KSLA News 12,2025-05-11T04:06:00+00:00
"Britain to face more cyberattacks as AI adoption grows, minister says","The growth of AI will increase the number and sophistication of cyberattacks on Britain, senior minister Pat McFadden said on Wednesday.",Reuters,2025-05-07T21:55:28+00:00
HubSpot has a big 'Aha!' moment around agents as AI adoption expands across business roles,"Companies want context across the whole customer journey, says CEO Yamini Rangan. Here's how HubSpot plans to deliver it.",diginomica,2025-05-09T11:21:00+00:00
"Sponsored Content: Meet Marron, a Sweet Rottweiler Mix Ready for Adoption at Saving Grace","Marron is a 44-pound Rottweiler mix with a calm, affectionate personality and great leash manners. She enjoys walks, couch time, and being close to her people, and she's crate-trained and sleeps",CBS 17,2025-05-08T15:37:00+00:00
Pets of the Week: Minnie and Winx are ready for adoption,"Winx is a 5-year-old orange-and-white tabby. This domestic shorthair is a calm boy who enjoys naps and head scratches. You can usually find him snuggled in his cat cave dreaming of his new home. If you are looking for a handsome, 16-pound cat to join your family, look no further. Visit Winx today.",Press-Telegram,2025-05-08T22:41:00+00:00
"Meet Tiramisu, the pet of the week available for adoption at the Nebraska Humane Society","While she's not a tiny dog, she sure thinks she is. She'll try to get in your lap for cuddle time and loves getting pets.",KETV,2025-05-09T18:46:00+00:00
"Potential adoption roadblocks could soon be removed as GOP ramps up pressure: 'Safe, loving homes'",Republican lawmakers are re-introducing legislation to make sure parents seeking to only raise a child of their biological sex do not face extra roadblocks in the adoption and fostering process.,Fox News,2025-05-07T16:53:17+00:00
Dog owner had 'dying wish' for beloved pups. Heartwarming adoption made it real,"A dog owner had a ""dying wish"" for his beloved pups — then an emotional adoption made his dream a reality. ""Please keep them together. Don't let them lose each other,"" the owner said, according to a North Carolina animal shelter's April 30 Facebook post.",Charlotte Observer,2025-05-09T18:15:35+00:00
Grand Companions sets upcoming adoption events,"Grand Companions has scheduled pet adoption events in Midland and Odessa. On Saturday, May 10, Grand Companions will be at 5.11 Tactical, 2900 Loop 250 Frontage Rd Ste. 125, Midland, from 10 a.m. to noon.",Yahoo,2025-05-08T15:50:00+00:00
'Pain. Grief. Anger': Families heartbroken as Trump backlash smashes adoption dreams,"They are meant for Cora, a little girl from China who was matched with Webb and her family for adoption more than five years ago. Webb, her husband and her two biological children have dealt with grief and confusion as their plans to finalize the adoption of the then-three-year-old girl with a congenital heart defect have encountered a series of political hurdles.",Raw Story,2025-05-05T10:06:40+00:00
