Company debuts building material that could revolutionize construction industry: 'One step closer to high-performance materials',"""On a scale that really matters."" Company debuts building material that could revolutionize construction industry: 'One step closer to high-performance materials' first appeared on The Cool Down.",The Cool Down,2025-05-10T11:45:00+00:00
Engineers make groundbreaking discovery in cement that could revolutionize the construction industry: 'Leap forward',The industry faces pressing issues that must be addressed. Engineers make groundbreaking discovery in cement that could revolutionize the construction industry: 'Leap forward' first appeared on The Cool Down.,The Cool Down,2025-05-12T09:00:00+00:00
Beyond Steel: 8 Lightweight Building Materials Revolutionizing Construction,"When it comes to building strong structures, steel and concrete have always been the go-to materials. But what if you could achieve the same strength and durabi",BDC Magazine,2025-05-06T08:57:00+00:00
Engineers invented an ultra-hard concrete alternative made of fungus and bacteria,A new fungi-based concrete alternative could finally give the construction industry the game-changing material it has been searching for.,BGR,2025-04-27T19:10:00+00:00
Fungi could be used to build homes one day. Meet the researchers trying to make it possible,"Researchers in Montana say they have found a way to turn fungus into a brick, which could eventually offer a more sustainable cement alternative.",CNN,2025-04-30T15:54:33+00:00
Iron-fortified lumber could be a greener alternative to steel beams,"Although lumber does show promise as a renewable alternative to structural materials such as steel and concrete, it still tends to be a bit weaker than those substances. Scientists have now set ...",New Atlas,2025-04-29T16:27:00+00:00
Fungus-based material could offer a sustainable concrete alternative,"It's a difficult problem to solve, because doing so will require us to find eco-friendly materials that are as ... and suitable for a range of construction projects.",New Atlas,2025-04-21T00:00:00+00:00
Living fungus-based building material repairs itself for over a month,Their results show that this material -- which is manufactured with living cells at low temperatures -- is capable of self-repairing and could eventually offer a sustainable alternative for high ...,Science Daily,2025-04-16T00:00:00+00:00
CHARACTERIZATION AND DEVELOPMENT OF ECO-FRIENDLY CONCRETE USING INDUSTRIAL WASTE - A REVIEW,"Advances in solid waste management resulted in alternative construction materials as a substitute to traditional materials like bricks, blocks, tiles, aggregates, ceramics, cement, lime, soil, timber and paint. To safeguard the environment, efforts are ...",JSTOR Daily,2024-09-05T05:24:00+00:00
"Magnesium Oxide Panels: A Durable, Fire-Resistant Alternative for Modern Construction","Magnesium Oxide (MgO) panels are revolutionizing the construction industry by offering superior fire resistance, exceptional durability, and resistance to moisture, mold, and pests. As an alternative to traditional materials like OSB, plywood, gypsum ...",Architectural Record,2025-04-11T10:48:00+00:00
NTU Singapore scientists create 'fungi tiles' with elephant skin texture to cool buildings,"The scientists also expect high inertia towards using mycelium tiles as an alternative construction ... Case Studies in Construction Materials, Volume 20, July 2024, e02786",EurekAlert!,2025-04-02T13:41:00+00:00
Quality Management for Alternative Delivery Methods,"The TCM members developed a research statement for advanced quality systems, and with the support of the AASHTO Subcommittee on Construction, The National Cooperative Highway Research program initiated NCHRP Project 10-83 - ""Alternative Quality Management ...",CU Boulder News & Events,2018-01-19T03:51:00+00:00
"Colorado economists warn of rising home prices, job losses as tariffs hit construction materials","Paired with tariffs on other construction materials, including lumber, the National Association of Home Builders estimates it will soon cost roughly $9,200 more to build a single-family home ...",Summit County,2025-04-21T00:00:00+00:00
RIBA Yorkshire Small and Emerging Practice Group: AlterNATIVE Constuction - Air Quality,"AlterNATIVE Construction in Harrogate. Sally Walker, founder of Native Architects, brings a wealth of experience and a deep commitment to sustainable and responsible architecture. Her practice is guided by strong environmental values, with a focus on ...",RIBA,2025-04-15T14:25:00+00:00
"Transformative $40 Million Soil Remediation Facility Launches in Philadelphia, Redefining Construction Waste Recovery","Alterra IOS, Eco Materials deliver state-of-the-art wash plant in South Philadelphia to process and repurpose over 750,000 tons of construction soil and waste annually; Facility p",The Manila Times,2025-05-02T16:41:00+00:00
Carbon-Negative Construction Materials Harnessing Seawater and CO2 Offer a Sustainable Path Forward,"Cement, concrete, paint, and plasters are customarily composed of or derived from calcium and magnesium based minerals, which are often sourced from aggregates what we call sand,"" Northwestern University senior researcher Dr.",Modern Engineering Marvels,2025-03-26T06:48:29+00:00
TômTex and Modern Meadow Dive Into the Future of Alternative Materials,"which requires a sequence of fewer processes than spun or woven alternative materials, McBee said its supply chain is fairly transparent. That provides it an advantage when speaking to clients-but ...",MSN,2025-04-01T21:12:00+00:00
Sustainable Construction: The United States and Global Trends Decrypted by the 3rd Edition of the Saint-Gobain Barometer,"In addition, US respondents see building energy efficiency as most connected to sustainable construction, with 72% of respondents associating the concepts. This is a drop of 11% compared to 2024, when it was 83%. Like in 2024, making sustainable materials ...",CSR Wire,2025-04-29T00:00:00+00:00
NASA reveals Earth's 'twin' planet is more active than we thought,"NASA researchers have discovered evidence of tectonic activity on Venus by re-examining decades-old radar data. The findings suggest that Venus's surface is fragmented into crustal blocks that shift and rotate,",The Times of India,2025-05-12T08:16:00+00:00
How the US can mine its own critical minerals − all without digging new holes,Rare earth elements are tiny yet essential parts of many of the technologies you use every day. New techniques are making their recovery from US sources increasingly viable.,ZME Science,2025-05-12T11:49:34+00:00
"What's an 'omega block,' and why is it messing with US weather right now?","A strange atmospheric pattern known as an ""omega block"" is preventing the usual eastward progression of weather across the U.S. — but what is this weird block, and when will it go away?",Live Science,2025-05-08T13:47:33+00:00
Earth's 'twin' is not dead but very much 'alive'; NASA's latest discovery explained,"In a breakthrough that could change how we see our ""twin"" planet, NASA has discovered that Venus may not be the hot, dead world we thought it was. Instead, its surface could be alive with movement, with chunks of crust slowly shifting and reshaping the planet,",The Economic Times,2025-05-11T12:01:58+00:00
"Ancient high-tech machines were used to build Egypt's pyramids, study claims","King Djoser of Egypt ordered his chief architect, Imhotep, to design a tomb like no other - The Step Pyramid of Djoser.",Earth.com,2025-05-11T15:32:00+00:00
The Building Blocks of Life May Have Come From Outer Space,"New research is shedding light on how such compounds might have formed and found their way to Earth. Fred Ciesla ... and nucleobases—the building blocks of proteins, cell membranes and RNA ...",Smithsonian Magazine,2025-04-16T18:45:00+00:00
Earth's water may not have originated from asteroids after all,"""What is new is that researchers have found the location of hydrogen in enstatite chondrites, the likely building blocks of the Earth,"" said Yves Marrocchi, a cosmochemist at the French ...",The Washington Post,2025-04-16T00:00:00+00:00
Stanley Miller's Experiment: Sparking the Building Blocks of Life,"In 1953, scientist Stanley Miller performed an experiment that may explain what occurred on primitive Earth billions of years ... they import the possible building blocks of life, not necessarily ...",PBS,2025-05-10T10:49:00+00:00
Space rocks carrying life's building blocks collide with UI research,Recent papers published in Nature and Nature Astronomy found life's building blocks on a near-Earth asteroid named Bennu.,The Daily Illini,2025-05-07T21:24:00+00:00
Origins of Water on Earth May Not Have Started with an Asteroid Impact,"Did the chemical components necessary to create water on Earth come from space or already exist here? One prevailing notion holds that asteroids containing either water of its building blocks bombarded the planet. But now, a team of researchers have ...",Discover Magazine,2025-04-15T20:01:00+00:00
"DNA-like molecule that could survive in Venus's harsh clouds, study finds","For a long time, Venus has been considered too hostile for life as we know it. Its thick clouds are filled with droplets of sulfuric acid, chlorine, iron, and other harsh chemicals—an environment that seemed impossible for organic molecules to survive.",Knowridge Science Report,2025-05-09T15:00:00+00:00
Origin of life twist: New study challenges longstanding hypothesis on how first sugars formed,"The prebiotic Earth was a harsh and unstable environment, characterized by intense heat, active volcanoes and little atmosphere. How, then, did the molecular building blocks of life first form? Among chemists,",Phys.org,2025-04-30T13:41:04+00:00
Spacecraft captures rare photo of a remnant from our solar system's formation,"NASA's Lucy spacecraft captures asteroid Donaldjohanson, marking a new step in its mission to explore the solar system's ancient past.",Earth.com,2025-04-29T21:48:00+00:00
China has a powerful card to play in its fight against Trump's trade war,"Touring its exhibition hall in 2019, Xi examined row upon row of unremarkable gray metal blocks and declared to ... China accounts for 61% of global mined rare earth production, but its control ...",CNN,2025-04-16T01:51:00+00:00
Scientists find evidence that challenges theories of the origin of water on Earth,"More information: Thomas J. Barrett et al,The source of hydrogen in earth's building blocks, Icarus (2025). DOI: 10.1016/j.icarus.2025.116588",Phys.org,2025-04-15T00:00:00+00:00
"Earth is headed toward several catastrophic climate 'tipping points,' study warns","Scientists assessed the risk of ""tipping"" in 16 different parts of the Earth system - ranging from the collapse of major ice sheets to the ""dieback"" of tropical coral reefs and vast forests.",USA Today,2025-04-23T00:00:00+00:00
Eco-voxels: Researchers pioneer reconfigurable building blocks for Earth and off-world construction,"More information: Dimitrios Georgiou et al, Eco-voxels: Building blocks for sustainable, load-bearing structures, Matter (2025). DOI: 10.1016/j.matt.2025.102106 Provided by Georgia Institute of ...",MSN,2025-04-18T16:07:00+00:00
Why the meteorites that hit Earth have less water than the asteroid bits brought back by space probes,"These asteroids are a direct window into the building blocks of our solar system and the origins of life. For a long time, scientists assumed that Earth's atmosphere filtered out carbonaceous debris.",Phys.org,2025-04-15T00:00:00+00:00
Scientists have found the origin of WATER on Earth,"Researchers now think that this water might have formed from hydrogen which was inside the planet's building blocks. This means that while some water did come from asteroids, most of Earth's water ...",MSN,2025-04-16T03:27:00+00:00
Strongest sign yet of possible life beyond Earth — study,"Madhusudhan told a press conference that detecting chemical fingerprints of gases, which on Earth are produced only ... based molecules are the building blocks of life) on the exoplanet, which ...",dw,2025-04-17T00:00:00+00:00
Former art gallery to become entrepreneurial hub in downtown Grand Rapids,"Detroit's Bamboo co-working company plans to renovate the four-story building with conference rooms, a reopened theater, and a rooftop patio, creating what Start Garden calls ""the biggest center we've had.",mlive,2025-05-12T19:03:00+00:00
Building a 100% Handmade Bamboo Swimming Pool!,"""In just one week, we built a breathtaking swimming pool entirely from bamboo! Using only natural materials and traditional building techniques, this project celebrates sustainability, creativity, and hands-on craftsmanship.",Primitive Tool,2025-05-12T13:41:58+00:00
Unique ways to use bamboo in your daily life,"Bamboo furniture is becoming increasingly popular owing to its durability and eco-friendliness. You can use it for everything from chairs and tables to beds and shelves. The natural look of the bamboo makes it elegant, while being sturdy enough for daily use.",NewsBytes,2025-05-06T09:52:00+00:00
Blue Bamboo announces June reopening in former Winter Park library,"Blue Bamboo Center for the Arts anticipates a June 22 reopening in the former Winter Park library building, which is being transformed into a jazz venue.",Orlando Sentinel,2025-05-09T13:00:00+00:00
"Rooftop patio, reopened theater, Start Garden: What's next for UICA building in downtown GR",The company that bought the former UICA building in downtown Grand Rapids plans on turning it into a center for entrepreneurship.,WOODTV.com,2025-05-06T16:55:53+00:00
Celoron Residents To Get Help In Knotweed Cleanup,"Burtis Bay residents are going to get some help with cleanup of Japanese Knotweed piles that have washed up on their shoreline - as long as invasive weed growth in Chautauqua Lake cooperates. Doug Conroe,",The Post-Journal,2025-05-10T06:39:00+00:00
Agusan del Norte farmers get new income source from bamboo textile fiber hub,"In Simbalan, Buenavista, Agusan del Norte, over 100 farmers—62 of whom are women, mostly mothers—are excited about the income opportunities offered by the Bamboo Textile Fiber Innovation Hub (BTFIH).",BusinessMirror,2025-05-11T00:44:00+00:00
Panda Hybrid Bamboo Mattress review 2025: The perfect Panda for tighter budgets,"The Panda Hybrid Bamboo mattress is the cheaper of two mattresses made by Panda. Offering many of the features found in the brand's more expensive mattress, the Panda Hybrid Bamboo Pro mattress (which we reviewed in 2023),",Tom's Guide,2025-05-07T17:00:00+00:00
Impressive triple-dome structure built from cardboard and bamboo,"It may be mostly used for packaging, but cardboard is a surprisingly capable building material in the right hands, as highlighted by Shigeru Ban Architects with its eye-catching Blue Ocean Dome. The eye-catching structure was created for Expo 2025 in Japan using a combination of cardboard,",New Atlas,2025-05-05T13:03:00+00:00
Maharashtra News: Palghar District Administration Launches Awareness Rallies To Promote Bamboo Farming And Boost Rural Development,"Palghar, Maharashtra: In a significant step towards environmental sustainability and rural development, the Palghar district administration is launching a series of awareness rallies to promote bamboo cultivation among farmers.",Free Press Journal,2025-05-09T12:17:00+00:00
"Elan Amadis, 'The Bamboo Guy,' believes farming can help reclaim the land in Haiti's northeast","Elan Amadis, a Haitian bamboo farmer, calls for credit access and policy to unlock Haiti's agricultural potential.",The Haitian Times,2025-05-01T16:10:00+00:00
"Walmart Is Selling a 'Durable' 3-Piece Bamboo Cutting Board Set for $23, and Shoppers Call It a 'Nice Trio'","Every kitchen needs a solid set of cutting boards for mise en place prep. Using super affordable plastic cutting boards works fine, but many Walmart shoppers said that they've dumped their old boards and replaced them with natural,",Yahoo,2025-05-03T09:00:00+00:00
Chinese Ikea supplier Long Bamboo Group to open furniture plant in Romania,"Chinese bamboo products manufacturer Long Bamboo Technology Group Co., a supplier to Swedish retailer IKEA, has entered the Romanian market to establish a furniture production facility, Profit.ro reported on May 8.",Romania Insider,2025-05-09T07:18:00+00:00
Awareness rallies to be held for bamboo plantation in Palghar district,"The administration in Maharashtra's Palghar district has announced awareness rallies to educate and mobilise farmers on the importance of bamboo plantation, an official said on Friday. The initiative is part of the state government's ambitious target to plant one crore bamboo trees across the Thane and Palghar districts.",The Print,2025-05-09T07:32:00+00:00
We Tested The Best Pajamas For Women That Are Cozy But Cool For Summer,"The Cozy Earth Bamboo Jogger Set earned the top spot on our list: It's made of a uniquely soft, stretchy bamboo viscose blend with temperature-regulating properties. Meanwhile, the Boll & Branch ...",Forbes,2025-05-02T18:34:00+00:00
Manchester man becomes first non-Japanese person to participate in traditional dance,"The Tanigumi Dance is an important tradition and part of Japan's cultural heritage. For the first time in its 800-year history, someone who is not from Japan was invited to join. In the dance, Matt Croasdale, 38, wore a massive, colorful bamboo fan that represents the wing of a phoenix and carried a large taiko drum.",WMUR Channel 9,2025-05-09T22:12:10+00:00
"How ingredients like bamboo, apple and chebula power a clean beauty revolution","The natural beauty boom is driving brands to rethink formulas, swapping long ingredient lists for simpler, plant-based options like bamboo, apple, and chebula.",ETX Daily Up,2025-04-30T11:00:00+00:00
"How tribal women in Gujarat's Kalibel are nurturing forests, children","In Dang's Kalibel, tribal women, many widowed, are transforming their lives through a native plant nursery. Earning around Rs 10,000 monthly, they cultivate bamboo and teak, boosting the environment and local economy.",The Times of India,2025-05-11T04:17:00+00:00
This Gond Village Earns Rs 1 Crore a Year From Bamboo — And Shares Every Rupee Equally,"In the early 2000s, Mendha Lekha became India's first village to gain community forest rights. Today, they earn over Rs 1 crore each year by selling bamboo sustainably, sharing the profits equally.",The Better India,2025-05-05T10:47:00+00:00
Breathing life into bamboo: The flute makers of Sreemoddi,"In the village of Sreemoddi under Cumilla's Homna upazila, the melodious craft of bamboo flute-making has quietly persisted for generations. Around 40 families are engaged in this time-honoured tradition, crafting nearly one crore flutes every year.",The Daily Star,2025-05-02T11:03:00+00:00
Why bamboo salt is trending in skincare,"Healthy skin thrives at a balanced pH level and African bamboo salt crystals are key to achieving that balance. Their inherent alkaline nature effectively neutralizes the skin's surface acidity. This action encourages the growth of beneficial bacteria, while also reducing skin irritation.",NewsBytes,2025-05-01T05:34:00+00:00
8 reasons why you should keep lucky bamboo at home,"Lucky bamboo is thought to attract positive energy, create a peaceful environment, and reduce stress levels. Research suggests that having greenery indoors can boost mental wellbeing, improve focus, and reduce stress.",DNA India,2025-04-30T11:47:00+00:00
Anatomy of a Classic: The Gucci Bamboo Diva Bag,"He turned to his son's bamboo walking sticks; imports of bamboo from Japan were plentiful at the time, and it helped that it was so lightweight and durable. Gucci's artisans soon patented a handcrafted process for heating,",Town & Country,2025-05-12T12:00:00+00:00
Bamboo: A Multidimensional Exploration from Genes to Ecosystem Services,"Bamboo, recognized as one of the fastest-growing plants globally, exhibits unique biological characteristics and holds significant ecological and economic",Frontiers,2025-05-07T08:58:00+00:00
China's Bamboo Forests: $80 Billion of Eco-Friendly Innovation You Need to See,"Explore the $80 billion bamboo industry in China, a natural wonder that's reshaping the global market and paving the way for sustainable innovation. In this captivating video, we dive deep into how bamboo has become a central player in an industry that spans across construction,",Manufacturing Insights,2025-05-03T12:18:32+00:00
Bamboo Roundhouse Built by Hand!,"Watch the full journey of building a sustainable roundhouse in the wild—using bamboo, rope, and traditional craftsmanship.",Primitive Tool,2025-05-08T12:32:18+00:00
A Bamboo Tower That Produces Water From Air,A Tesla worker built a website protesting Elon Musk. He was fired a few days later.,YouTube,2025-05-08T10:17:41+00:00
How We Found Water Deep in the Jungle | Bamboo Well Build,"Deep in the forest, we begin the journey to find natural groundwater using only bamboo and traditional techniques. This first part shows how we scout, dig, and build a primitive well—an essential survival skill for off-grid living.",Primitive Tool,2025-05-07T12:06:45+00:00
"Man falls into sewage while attempting to cross with bamboo pole in Bangkok, Thailand","On April 23, 2025, in Bangkok, Thailand, @rocky_1809 shared a video of a man failing to cross an open sewage canal. In the video, the man is seen holding a bamboo pole, attempting to leap across the water.",Amazon S3,2025-05-05T12:10:37+00:00
15 Days Building a Private Bamboo Pool & Decorated Jungle Villa,"We built a bamboo swimming pool and a decorated villa by hand—featuring a full living room, custom furniture, and jungle tranquility. While we work in the wilderness to complete these stunning projects,",Primitive Survival Tool,2025-05-08T13:00:05+00:00
Turning bamboo into a stunning salad bowl,"In this woodturning video, I will transform a bamboo cutting board into a deep salad bowl using power tools and imagination. I also incorporated other hardwoods like wenge, purpleheart, and sapele for better contrast.",David's Woodturning,2025-05-03T16:00:00+00:00
"FG begins bamboo factory in Kogi, plans seven more across Nigeria","The Federal Government has commenced the development of a bamboo processing factory in Kogi State as part of efforts to provide alternatives to tree felling and promote sustainable forest use.The Minister of Environment,",The Punch,2025-05-07T14:01:11+00:00
Kylie Jenner Debuts an Archival Gucci Bamboo Bag Ahead of the 2025 Met Gala,"While stars like Tyla and Rihanna were busy pre-gaming their 2025 Met Gala looks with elaborate night-before costumes, Kylie Jenner was in Florida doing her own thing. The beauty mogul spent the weekend in Miami for the Formula 1 Grand Prix,",Marie Claire,2025-05-05T13:59:07+00:00
Is recycled asphalt safe for roads? New study weighs in,"Researchers study recycled asphalt pavement RAP to assess its skid resistance and safety, aiming to make roads more sustainable without risks.",The Daily Reporter,2025-05-08T22:40:00+00:00
Can recycled asphalt keep roads safe and sustainable?,Recycled asphalt can cut emissions and save resources — but can it match new pavement's safety? Researchers explore RAP's durability and skid resistance.,The Conversation,2025-05-09T01:18:00+00:00
PureCycle Achieves New Milestone in Recycled Plastic Film Trials,The company's positive progress in trials demonstrates PureFive recycled resin's ability to produce biaxially oriented polypropylene (BOPP) film suitable for flexible packaging applications.,Packaging World,2025-05-12T13:52:00+00:00
Meijer stores collecting used or unneeded baby gear to be recycled,Don't toss used baby gear. Meijer stores are collecting those unneeded or used items to recycle and giving a discount coupon for them.,Detroit Free Press,2025-05-05T18:31:55+00:00
Transform Small Recycled Woods into a Stunning DIY Wooden Table with Creative Woodworking Ideas,"Creative woodworking ideas come to life as small recycled woods are transformed into a stunning DIY wooden table. By repurposing discarded wood pieces, the project demonstrates how to create a beautiful and functional table while embracing sustainability.",Wood Season,2025-05-11T11:36:29+00:00
"Nanoplastics generated from real-world plastic waste readily adsorb heavy metal ions, study reveals","Some 460 million metric tons of plastic are produced globally each year, out of which a staggering 91% of plastic waste is never recycled—with 12% incinerated and 79% left to end up in landfills and oceans and linger in our environment.",Phys.org,2025-05-10T14:20:01+00:00
Recycled wastewater could solve dwindling water supplies. This expert wants to remove 'ick' factor,"Communities around Arizona and the country are looking at recycled wastewater as a solution for dwindling water supplies, including as drinking water. For lots of residents, the reaction has been ""yuck.",KJZZ,2025-05-02T19:00:00+00:00
Mondi starts up recycled containerboard mill in Italy,The company bought the site in 2023 and invested more than $200 million to convert the mill from producing coated mechanical paper to recycled containerboard.,Recycling Today,2025-05-07T18:17:00+00:00
2 Childhood Friends in Bengaluru Are Making Stationery Sustainable with 500 Tonnes of Recycled Paper,"Childhood friends Naren Raj and Ashutosh Ananth are the co-founders of Rescript, a Bengaluru-based sustainable stationery brand that is reshaping how India thinks about paper. By turning waste paper into eco-friendly products,",The Better India,2025-05-09T09:21:00+00:00
